sep=;
Hole No;Sheet No;Start Depth;End Depth;Soil/Rock Description;Soil/Rock Type;Confidence Level
ASA_v1;1;0.00;3.50;Angular COBBLES and GRAVELS of moderately decomposed granite with some brown silty SAND and some concrete fragments. (FILL);Fill;High
ASA_v1;1;3.50;18.70;Wash Boring. (No Recovery);No Recovery;High
ASA_v1;2;18.70;19.30;Sub-rounded COBBLES and GRAVELS of moderately decomposed granite and tuff with some grey silty sand. (ALLUVIUM);Alluvium;High
ASA_v1;2;19.30;20.70;Wash Boring. (No Recovery);No Recovery;High
ASA_v1;3;20.70;25.90;Moderately strong, brownish pink spotted black and white, moderately decomposed medium to coarse grained GRANITE with medium to closely spaced, extremely narrow to very narrow, rough planar, limonite, manganese stained and kaolin coated joints, dipping 10 degrees-20 degrees and 70 degrees-80 degrees.;Granite;High
