sep=;
Hole No;Easting;Northing;Sheet No;Start Depth;End Depth;Grade;Soil/Rock Description;Soil/Rock Type;Confidence Level
B1_v1;839907.25;816554.26;1;0.00;0.20;;Concrete slab;Concrete;1.00
B1_v1;839907.25;816554.26;1;0.20;0.80;;Brown, gravelly silty medium to coarse SAND. (FILL);Fill;1.00
B1_v1;839907.25;816554.26;1;0.80;19.00;;Wash boring.;No Recovery;1.00
B1_v1;839907.25;816554.26;2;19.00;19.30;;Sub-angular Cobbles and Gravels of moderately decomposed granite and tuff with some brown, silty SAND. (ALLUVIUM);Alluvium;1.00
B1_v1;839907.25;816554.26;2;19.30;22.83;;Wash boring.;No Recovery;1.00
B1_v1;839907.25;816554.26;3;22.83;23.52;III;Moderately weak to moderately strong, brownish pink spotted black and white, moderately decomposed medium to coarse grained GRANITE with widely to medium spaced and occasionally closely spaced, very narrow to extremely narrow, rough planar, limonite, manganese stained, kaolin and chloride coated joints, dipping 10-20, 70-85.;Granite;1.00
B1_v1;839907.25;816554.26;3;23.52;23.82;IV/III;Weak to moderately weak, brownish pink spotted black and white, highly to moderately decomposed GRANITE;Granite;1.00
B1_v1;839907.25;816554.26;3;23.82;24.11;IV;Weak, highly decomposed zone No recovery 23.97-24.11m.;Granite;1.00
B1_v1;839907.25;816554.26;3;24.11;33.32;III;Moderately weak to moderately strong, brownish pink spotted black and white, moderately decomposed medium to coarse grained GRANITE with widely to medium spaced and occasionally closely spaced, very narrow to extremely narrow, rough planar, limonite, manganese stained, kaolin and chloride coated joints, dipping 10-20, 70-85.;Granite;1.00
