sep=;
Hole No;Easting;Northing;Sheet No;Start Depth;End Depth;Grade;Soil/Rock Description;Soil/Rock Type;Confidence Level
C2_v1;839916.25;816543.71;1;0.00;1.50;;Concrete with steel bar.;Concrete;1.00
C2_v1;839916.25;816543.71;1;1.50;4.00;;Wash boring. (No recovery);No Recovery;1.00
C2_v1;839916.25;816543.71;1;4.00;4.90;;Angular BOULDER, COBBLES and GRAVELS of moderately decomposed granite and tuff with some brown, silty SAND. (FILL);Fill;1.00
C2_v1;839916.25;816543.71;1;4.90;19.60;;Wash boring. (No recovery);No Recovery;0.95
C2_v1;839916.25;816543.71;2;19.60;20.00;;Sub-rounded COBBLES and GRAVELS of moderately decomposed granite and tuff with some brown silty SAND. (ALLUVIUM);Alluvium;1.00
C2_v1;839916.25;816543.71;3;20.00;26.33;;Wash boring. (No recovery);No Recovery;0.95
C2_v1;839916.25;816543.71;3;26.33;31.39;III;Moderately strong, brownish pink spotted black and white, moderately decomposed medium to coarse grained GRANITE with widely to medium spaced, extremely narrow, rough planar, limonite, manganese and kaolin stained joints, dipping 10-20, 40-50, 75-85 and occasionally vertical joints.;Granite;1.00
